{
  "name": "valid-full",
  "version": "3.1.0-beta.1",
  "description": "Test fixture with all optional fields",
  "author": { "name": "Full Author" },
  "homepage": "https://example.com/valid-full",
  "repository": "https://github.com/test/valid-full",
  "license": "MIT",
  "keywords": ["test", "fixture", "full"],
  "commands": ["./commands/example.md"],
  "agents": ["./agents/full-example-agent.md"],
  "hooks": {
    "PostToolUse": [
      {
        "matcher": "Bash",
        "hooks": [
          {
            "type": "command",
            "command": "echo 'post tool use'"
          }
        ]
      }
    ]
  }
}
