{
  "name": "foobar",
  "version": "1.0.0",
  "description": "A Claude Code plugin",
  "author": {
    "name": "Cameleon X"
  },
  "homepage": "https://github.com/YOUR-USERNAME/foobar",
  "repository": "https://github.com/YOUR-USERNAME/foobar",
  "license": "MIT",
  "keywords": [
    "claude-code",
    "plugin"
  ],
  "commands": [
    "./commands/example.md"
  ],
  "agents": [
    "./agents/foobar-example-agent.md"
  ]
}
