{
  "name": "valid-hooks-only",
  "version": "2.0.0",
  "description": "Test fixture with inline hooks",
  "author": { "name": "Test Author" },
  "hooks": {
    "SessionStart": [
      {
        "hooks": [
          {
            "type": "command",
            "command": "bash \"${CLAUDE_PLUGIN_ROOT}/scripts/setup.sh\" 2>&1 || true"
          }
        ]
      }
    ]
  }
}
